[{"alvo":"ALVO-0019","arquivo":"api_views/users.py","condicao":"C1","confianca":"media","confianca_original":"MEDIUM","cwe":"CWE-259","cwe_original":"259","descricao":"Possible hardcoded password: ''","evidencia":"121         except:\n122             auth_token = \"\"\n123     else:\n","execucao_id":"C1-ALVO-0019-R01","ferramenta":"bandit","linha_final":122,"linha_inicial":122,"recomendacao":null,"regra":"B105","repeticao":1,"saida_bruta_sha256":"5af520f288059c9a9896b62aa94973861dec3634d7e1bfaeea42e68f79c7cabc","schema_version":"1.0","severidade":"baixa","severidade_original":"LOW","texto_original":"{\"code\":\"121         except:\\n122             auth_token = \\\"\\\"\\n123     else:\\n\",\"col_offset\":25,\"end_col_offset\":27,\"filename\":\"/entrada/api_views/users.py\",\"issue_confidence\":\"MEDIUM\",\"issue_cwe\":{\"id\":259,\"link\":\"https://cwe.mitre.org/data/definitions/259.html\"},\"issue_severity\":\"LOW\",\"issue_text\":\"Possible hardcoded password: ''\",\"line_number\":122,\"line_range\":[122],\"more_info\":\"https://bandit.readthedocs.io/en/1.9.4/plugins/b105_hardcoded_password_string.html\",\"test_id\":\"B105\",\"test_name\":\"hardcoded_password_string\"}"},{"alvo":"ALVO-0019","arquivo":"api_views/users.py","condicao":"C1","confianca":"media","confianca_original":"MEDIUM","cwe":"CWE-259","cwe_original":"259","descricao":"Possible hardcoded password: ''","evidencia":"123     else:\n124         auth_token = \"\"\n125     if auth_token:\n","execucao_id":"C1-ALVO-0019-R01","ferramenta":"bandit","linha_final":124,"linha_inicial":124,"recomendacao":null,"regra":"B105","repeticao":1,"saida_bruta_sha256":"5af520f288059c9a9896b62aa94973861dec3634d7e1bfaeea42e68f79c7cabc","schema_version":"1.0","severidade":"baixa","severidade_original":"LOW","texto_original":"{\"code\":\"123     else:\\n124         auth_token = \\\"\\\"\\n125     if auth_token:\\n\",\"col_offset\":21,\"end_col_offset\":23,\"filename\":\"/entrada/api_views/users.py\",\"issue_confidence\":\"MEDIUM\",\"issue_cwe\":{\"id\":259,\"link\":\"https://cwe.mitre.org/data/definitions/259.html\"},\"issue_severity\":\"LOW\",\"issue_text\":\"Possible hardcoded password: ''\",\"line_number\":124,\"line_range\":[124],\"more_info\":\"https://bandit.readthedocs.io/en/1.9.4/plugins/b105_hardcoded_password_string.html\",\"test_id\":\"B105\",\"test_name\":\"hardcoded_password_string\"}"},{"alvo":"ALVO-0019","arquivo":"api_views/users.py","condicao":"C1","confianca":"media","confianca_original":"MEDIUM","cwe":"CWE-259","cwe_original":"259","descricao":"Possible hardcoded password: 'Updated.'","evidencia":"198                 'status': 'success',\n199                 'Password': 'Updated.'\n200             }\n201             return Response(json.dumps(responseObject), 204, mimetype=\"application/json\")\n202         else:\n203             return Response(error_message_helper(\"Malformed Data\"), 400, mimetype=\"application/json\")\n","execucao_id":"C1-ALVO-0019-R01","ferramenta":"bandit","linha_final":200,"linha_inicial":197,"recomendacao":null,"regra":"B105","repeticao":1,"saida_bruta_sha256":"5af520f288059c9a9896b62aa94973861dec3634d7e1bfaeea42e68f79c7cabc","schema_version":"1.0","severidade":"baixa","severidade_original":"LOW","texto_original":"{\"code\":\"198                 'status': 'success',\\n199                 'Password': 'Updated.'\\n200             }\\n201             return Response(json.dumps(responseObject), 204, mimetype=\\\"application/json\\\")\\n202         else:\\n203             return Response(error_message_helper(\\\"Malformed Data\\\"), 400, mimetype=\\\"application/json\\\")\\n\",\"col_offset\":16,\"end_col_offset\":26,\"filename\":\"/entrada/api_views/users.py\",\"issue_confidence\":\"MEDIUM\",\"issue_cwe\":{\"id\":259,\"link\":\"https://cwe.mitre.org/data/definitions/259.html\"},\"issue_severity\":\"LOW\",\"issue_text\":\"Possible hardcoded password: 'Updated.'\",\"line_number\":199,\"line_range\":[197,198,199,200],\"more_info\":\"https://bandit.readthedocs.io/en/1.9.4/plugins/b105_hardcoded_password_string.html\",\"test_id\":\"B105\",\"test_name\":\"hardcoded_password_string\"}"},{"alvo":"ALVO-0019","arquivo":"app.py","condicao":"C1","confianca":"media","confianca_original":"MEDIUM","cwe":"CWE-605","cwe_original":"605","descricao":"Possible binding to all interfaces.","evidencia":"16 if __name__ == '__main__':\n17     vuln_app.run(host='0.0.0.0', port=5000, debug=True)\n","execucao_id":"C1-ALVO-0019-R01","ferramenta":"bandit","linha_final":17,"linha_inicial":17,"recomendacao":null,"regra":"B104","repeticao":1,"saida_bruta_sha256":"5af520f288059c9a9896b62aa94973861dec3634d7e1bfaeea42e68f79c7cabc","schema_version":"1.0","severidade":"media","severidade_original":"MEDIUM","texto_original":"{\"code\":\"16 if __name__ == '__main__':\\n17     vuln_app.run(host='0.0.0.0', port=5000, debug=True)\\n\",\"col_offset\":22,\"end_col_offset\":31,\"filename\":\"/entrada/app.py\",\"issue_confidence\":\"MEDIUM\",\"issue_cwe\":{\"id\":605,\"link\":\"https://cwe.mitre.org/data/definitions/605.html\"},\"issue_severity\":\"MEDIUM\",\"issue_text\":\"Possible binding to all interfaces.\",\"line_number\":17,\"line_range\":[17],\"more_info\":\"https://bandit.readthedocs.io/en/1.9.4/plugins/b104_hardcoded_bind_all_interfaces.html\",\"test_id\":\"B104\",\"test_name\":\"hardcoded_bind_all_interfaces\"}"},{"alvo":"ALVO-0019","arquivo":"config.py","condicao":"C1","confianca":"media","confianca_original":"MEDIUM","cwe":"CWE-259","cwe_original":"259","descricao":"Possible hardcoded password: 'random'","evidencia":"12 \n13 vuln_app.app.config['SECRET_KEY'] = 'random'\n14 # start the db\n","execucao_id":"C1-ALVO-0019-R01","ferramenta":"bandit","linha_final":13,"linha_inicial":13,"recomendacao":null,"regra":"B105","repeticao":1,"saida_bruta_sha256":"5af520f288059c9a9896b62aa94973861dec3634d7e1bfaeea42e68f79c7cabc","schema_version":"1.0","severidade":"baixa","severidade_original":"LOW","texto_original":"{\"code\":\"12 \\n13 vuln_app.app.config['SECRET_KEY'] = 'random'\\n14 # start the db\\n\",\"col_offset\":20,\"end_col_offset\":32,\"filename\":\"/entrada/config.py\",\"issue_confidence\":\"MEDIUM\",\"issue_cwe\":{\"id\":259,\"link\":\"https://cwe.mitre.org/data/definitions/259.html\"},\"issue_severity\":\"LOW\",\"issue_text\":\"Possible hardcoded password: 'random'\",\"line_number\":13,\"line_range\":[13],\"more_info\":\"https://bandit.readthedocs.io/en/1.9.4/plugins/b105_hardcoded_password_string.html\",\"test_id\":\"B105\",\"test_name\":\"hardcoded_password_string\"}"},{"alvo":"ALVO-0019","arquivo":"models/user_model.py","condicao":"C1","confianca":"baixa","confianca_original":"LOW","cwe":"CWE-89","cwe_original":"89","descricao":"Possible SQL injection vector through string-based query construction.","evidencia":"71         if vuln:  # SQLi Injection\n72             user_query = f\"SELECT * FROM users WHERE username = '{username}'\"\n73             query = db.session.execute(text(user_query))\n","execucao_id":"C1-ALVO-0019-R01","ferramenta":"bandit","linha_final":72,"linha_inicial":72,"recomendacao":null,"regra":"B608","repeticao":1,"saida_bruta_sha256":"5af520f288059c9a9896b62aa94973861dec3634d7e1bfaeea42e68f79c7cabc","schema_version":"1.0","severidade":"media","severidade_original":"MEDIUM","texto_original":"{\"code\":\"71         if vuln:  # SQLi Injection\\n72             user_query = f\\\"SELECT * FROM users WHERE username = '{username}'\\\"\\n73             query = db.session.execute(text(user_query))\\n\",\"col_offset\":27,\"end_col_offset\":65,\"filename\":\"/entrada/models/user_model.py\",\"issue_confidence\":\"LOW\",\"issue_cwe\":{\"id\":89,\"link\":\"https://cwe.mitre.org/data/definitions/89.html\"},\"issue_severity\":\"MEDIUM\",\"issue_text\":\"Possible SQL injection vector through string-based query construction.\",\"line_number\":72,\"line_range\":[72],\"more_info\":\"https://bandit.readthedocs.io/en/1.9.4/plugins/b608_hardcoded_sql_expressions.html\",\"test_id\":\"B608\",\"test_name\":\"hardcoded_sql_expressions\"}"},{"alvo":"ALVO-0019","arquivo":"models/user_model.py","condicao":"C1","confianca":"alta","confianca_original":"HIGH","cwe":"CWE-330","cwe_original":"330","descricao":"Standard pseudo-random generators are not suitable for security/cryptographic purposes.","evidencia":"85         new_user = User(username=username, password=password, email=email, admin=admin)\n86         randomint = str(randrange(100))\n87         new_user.books = [Book(book_title=\"bookTitle\" + randomint, secret_content=\"secret for bookTitle\" + randomint)]\n","execucao_id":"C1-ALVO-0019-R01","ferramenta":"bandit","linha_final":86,"linha_inicial":86,"recomendacao":null,"regra":"B311","repeticao":1,"saida_bruta_sha256":"5af520f288059c9a9896b62aa94973861dec3634d7e1bfaeea42e68f79c7cabc","schema_version":"1.0","severidade":"baixa","severidade_original":"LOW","texto_original":"{\"code\":\"85         new_user = User(username=username, password=password, email=email, admin=admin)\\n86         randomint = str(randrange(100))\\n87         new_user.books = [Book(book_title=\\\"bookTitle\\\" + randomint, secret_content=\\\"secret for bookTitle\\\" + randomint)]\\n\",\"col_offset\":24,\"end_col_offset\":38,\"filename\":\"/entrada/models/user_model.py\",\"issue_confidence\":\"HIGH\",\"issue_cwe\":{\"id\":330,\"link\":\"https://cwe.mitre.org/data/definitions/330.html\"},\"issue_severity\":\"LOW\",\"issue_text\":\"Standard pseudo-random generators are not suitable for security/cryptographic purposes.\",\"line_number\":86,\"line_range\":[86],\"more_info\":\"https://bandit.readthedocs.io/en/1.9.4/blacklists/blacklist_calls.html#b311-random\",\"test_id\":\"B311\",\"test_name\":\"blacklist\"}"}]