[{"alvo":"ALVO-0001","arquivo":"app.py","condicao":"C1","confianca":"alta","confianca_original":"HIGH","cwe":"CWE-502","cwe_original":"502","descricao":"Consider possible security implications associated with pickle module.","evidencia":"1 import pickle\n2 from base64 import b64decode,b64encode\n3 from binascii import hexlify, unhexlify\n","execucao_id":"C1-ALVO-0001-R01","ferramenta":"bandit","linha_final":1,"linha_inicial":1,"recomendacao":null,"regra":"B403","repeticao":1,"saida_bruta_sha256":"8a851988a9e31af61912b778639fa835b73652c363ef1faf48460469e48b74bc","schema_version":"1.0","severidade":"baixa","severidade_original":"LOW","texto_original":"{\"code\":\"1 import pickle\\n2 from base64 import b64decode,b64encode\\n3 from binascii import hexlify, unhexlify\\n\",\"col_offset\":0,\"end_col_offset\":13,\"filename\":\"/entrada/app.py\",\"issue_confidence\":\"HIGH\",\"issue_cwe\":{\"id\":502,\"link\":\"https://cwe.mitre.org/data/definitions/502.html\"},\"issue_severity\":\"LOW\",\"issue_text\":\"Consider possible security implications associated with pickle module.\",\"line_number\":1,\"line_range\":[1],\"more_info\":\"https://bandit.readthedocs.io/en/1.9.4/blacklists/blacklist_imports.html#b403-import-pickle\",\"test_id\":\"B403\",\"test_name\":\"blacklist\"}"},{"alvo":"ALVO-0001","arquivo":"app.py","condicao":"C1","confianca":"media","confianca_original":"MEDIUM","cwe":"CWE-259","cwe_original":"259","descricao":"Possible hardcoded password: 'Harry Potter And The Deathly Hallows'","evidencia":"14 app = Flask(__name__)\n15 app.secret_key = 'Harry Potter And The Deathly Hallows'\n16 app.config['SQLALCHEMY_DATABASE_URI'] = 'sqlite:///test.db'\n","execucao_id":"C1-ALVO-0001-R01","ferramenta":"bandit","linha_final":15,"linha_inicial":15,"recomendacao":null,"regra":"B105","repeticao":1,"saida_bruta_sha256":"8a851988a9e31af61912b778639fa835b73652c363ef1faf48460469e48b74bc","schema_version":"1.0","severidade":"baixa","severidade_original":"LOW","texto_original":"{\"code\":\"14 app = Flask(__name__)\\n15 app.secret_key = 'Harry Potter And The Deathly Hallows'\\n16 app.config['SQLALCHEMY_DATABASE_URI'] = 'sqlite:///test.db'\\n\",\"col_offset\":17,\"end_col_offset\":55,\"filename\":\"/entrada/app.py\",\"issue_confidence\":\"MEDIUM\",\"issue_cwe\":{\"id\":259,\"link\":\"https://cwe.mitre.org/data/definitions/259.html\"},\"issue_severity\":\"LOW\",\"issue_text\":\"Possible hardcoded password: 'Harry Potter And The Deathly Hallows'\",\"line_number\":15,\"line_range\":[15],\"more_info\":\"https://bandit.readthedocs.io/en/1.9.4/plugins/b105_hardcoded_password_string.html\",\"test_id\":\"B105\",\"test_name\":\"hardcoded_password_string\"}"},{"alvo":"ALVO-0001","arquivo":"app.py","condicao":"C1","confianca":"alta","confianca_original":"HIGH","cwe":"CWE-78","cwe_original":"78","descricao":"Use of possibly insecure function - consider using safer ast.literal_eval.","evidencia":"119        <link rel= \"stylesheet\" type= \"text/css\" href=\"/static/styles/board.css\"\">\n120        <body>\"\"\" + \"Result: \" + (str(eval(expression)).replace('\\n', '\\n<br>')  if expression else \"\") + \"\"\"\n121           <form action = \"/evaluate\" method = \"POST\">\n","execucao_id":"C1-ALVO-0001-R01","ferramenta":"bandit","linha_final":120,"linha_inicial":120,"recomendacao":null,"regra":"B307","repeticao":1,"saida_bruta_sha256":"8a851988a9e31af61912b778639fa835b73652c363ef1faf48460469e48b74bc","schema_version":"1.0","severidade":"media","severidade_original":"MEDIUM","texto_original":"{\"code\":\"119        <link rel= \\\"stylesheet\\\" type= \\\"text/css\\\" href=\\\"/static/styles/board.css\\\"\\\">\\n120        <body>\\\"\\\"\\\" + \\\"Result: \\\" + (str(eval(expression)).replace('\\\\n', '\\\\n<br>')  if expression else \\\"\\\") + \\\"\\\"\\\"\\n121           <form action = \\\"/evaluate\\\" method = \\\"POST\\\">\\n\",\"col_offset\":37,\"end_col_offset\":53,\"filename\":\"/entrada/app.py\",\"issue_confidence\":\"HIGH\",\"issue_cwe\":{\"id\":78,\"link\":\"https://cwe.mitre.org/data/definitions/78.html\"},\"issue_severity\":\"MEDIUM\",\"issue_text\":\"Use of possibly insecure function - consider using safer ast.literal_eval.\",\"line_number\":120,\"line_range\":[120],\"more_info\":\"https://bandit.readthedocs.io/en/1.9.4/blacklists/blacklist_calls.html#b307-eval\",\"test_id\":\"B307\",\"test_name\":\"blacklist\"}"},{"alvo":"ALVO-0001","arquivo":"app.py","condicao":"C1","confianca":"alta","confianca_original":"HIGH","cwe":"CWE-703","cwe_original":"703","descricao":"Try, Except, Pass detected.","evidencia":"160             parsed_xml = etree.tostring(doc)\n161         except:\n162            pass\n163     return \"\"\"\n","execucao_id":"C1-ALVO-0001-R01","ferramenta":"bandit","linha_final":162,"linha_inicial":161,"recomendacao":null,"regra":"B110","repeticao":1,"saida_bruta_sha256":"8a851988a9e31af61912b778639fa835b73652c363ef1faf48460469e48b74bc","schema_version":"1.0","severidade":"baixa","severidade_original":"LOW","texto_original":"{\"code\":\"160             parsed_xml = etree.tostring(doc)\\n161         except:\\n162            pass\\n163     return \\\"\\\"\\\"\\n\",\"col_offset\":8,\"end_col_offset\":15,\"filename\":\"/entrada/app.py\",\"issue_confidence\":\"HIGH\",\"issue_cwe\":{\"id\":703,\"link\":\"https://cwe.mitre.org/data/definitions/703.html\"},\"issue_severity\":\"LOW\",\"issue_text\":\"Try, Except, Pass detected.\",\"line_number\":161,\"line_range\":[161,162],\"more_info\":\"https://bandit.readthedocs.io/en/1.9.4/plugins/b110_try_except_pass.html\",\"test_id\":\"B110\",\"test_name\":\"try_except_pass\"}"},{"alvo":"ALVO-0001","arquivo":"app.py","condicao":"C1","confianca":"media","confianca_original":"MEDIUM","cwe":"CWE-605","cwe_original":"605","descricao":"Possible binding to all interfaces.","evidencia":"210         db.create_all()\n211     app.run(host=\"0.0.0.0\", port=8000)\n","execucao_id":"C1-ALVO-0001-R01","ferramenta":"bandit","linha_final":211,"linha_inicial":211,"recomendacao":null,"regra":"B104","repeticao":1,"saida_bruta_sha256":"8a851988a9e31af61912b778639fa835b73652c363ef1faf48460469e48b74bc","schema_version":"1.0","severidade":"media","severidade_original":"MEDIUM","texto_original":"{\"code\":\"210         db.create_all()\\n211     app.run(host=\\\"0.0.0.0\\\", port=8000)\\n\",\"col_offset\":17,\"end_col_offset\":26,\"filename\":\"/entrada/app.py\",\"issue_confidence\":\"MEDIUM\",\"issue_cwe\":{\"id\":605,\"link\":\"https://cwe.mitre.org/data/definitions/605.html\"},\"issue_severity\":\"MEDIUM\",\"issue_text\":\"Possible binding to all interfaces.\",\"line_number\":211,\"line_range\":[211],\"more_info\":\"https://bandit.readthedocs.io/en/1.9.4/plugins/b104_hardcoded_bind_all_interfaces.html\",\"test_id\":\"B104\",\"test_name\":\"hardcoded_bind_all_interfaces\"}"}]