[{"alvo":"ALVO-0007","arquivo":"sqli/dao/student.py","condicao":"C1","confianca":"baixa","confianca_original":"LOW","cwe":"CWE-89","cwe_original":"89","descricao":"Possible SQL injection vector through string-based query construction.","evidencia":"41     async def create(conn: Connection, name: str):\n42         q = (\"INSERT INTO students (name) \"\n43              \"VALUES ('%(name)s')\" % {'name': name})\n44         async with conn.cursor() as cur:\n","execucao_id":"C1-ALVO-0007-R01","ferramenta":"bandit","linha_final":43,"linha_inicial":42,"recomendacao":null,"regra":"B608","repeticao":1,"saida_bruta_sha256":"8fa8cb8f2f93a06014ce6109a1995d34c6aaebec3eb6debf1e5e7dbd5d6b6187","schema_version":"1.0","severidade":"media","severidade_original":"MEDIUM","texto_original":"{\"code\":\"41     async def create(conn: Connection, name: str):\\n42         q = (\\\"INSERT INTO students (name) \\\"\\n43              \\\"VALUES ('%(name)s')\\\" % {'name': name})\\n44         async with conn.cursor() as cur:\\n\",\"col_offset\":13,\"end_col_offset\":34,\"filename\":\"/entrada/sqli/dao/student.py\",\"issue_confidence\":\"LOW\",\"issue_cwe\":{\"id\":89,\"link\":\"https://cwe.mitre.org/data/definitions/89.html\"},\"issue_severity\":\"MEDIUM\",\"issue_text\":\"Possible SQL injection vector through string-based query construction.\",\"line_number\":42,\"line_range\":[42,43],\"more_info\":\"https://bandit.readthedocs.io/en/1.9.4/plugins/b608_hardcoded_sql_expressions.html\",\"test_id\":\"B608\",\"test_name\":\"hardcoded_sql_expressions\"}"},{"alvo":"ALVO-0007","arquivo":"sqli/dao/user.py","condicao":"C1","confianca":"alta","confianca_original":"HIGH","cwe":"CWE-327","cwe_original":"327","descricao":"Use of weak MD5 hash for security. Consider usedforsecurity=False","evidencia":"40     def check_password(self, password: str):\n41         return self.pwd_hash == md5(password.encode('utf-8')).hexdigest()\n","execucao_id":"C1-ALVO-0007-R01","ferramenta":"bandit","linha_final":41,"linha_inicial":41,"recomendacao":null,"regra":"B324","repeticao":1,"saida_bruta_sha256":"8fa8cb8f2f93a06014ce6109a1995d34c6aaebec3eb6debf1e5e7dbd5d6b6187","schema_version":"1.0","severidade":"alta","severidade_original":"HIGH","texto_original":"{\"code\":\"40     def check_password(self, password: str):\\n41         return self.pwd_hash == md5(password.encode('utf-8')).hexdigest()\\n\",\"col_offset\":32,\"end_col_offset\":61,\"filename\":\"/entrada/sqli/dao/user.py\",\"issue_confidence\":\"HIGH\",\"issue_cwe\":{\"id\":327,\"link\":\"https://cwe.mitre.org/data/definitions/327.html\"},\"issue_severity\":\"HIGH\",\"issue_text\":\"Use of weak MD5 hash for security. Consider usedforsecurity=False\",\"line_number\":41,\"line_range\":[41],\"more_info\":\"https://bandit.readthedocs.io/en/1.9.4/plugins/b324_hashlib.html\",\"test_id\":\"B324\",\"test_name\":\"hashlib\"}"}]