[{"alvo":"ALVO-SINTETICO","arquivo":"alvo_vulneravel.py","condicao":"C2","confianca":null,"confianca_original":"LOW","cwe":"CWE-78","cwe_original":["CWE-78: Improper Neutralization of Special Elements used in an OS Command ('OS Command Injection')"],"descricao":"Detected subprocess function 'Popen' without a static string. If this data can be controlled by a malicious actor, it may be an instance of command injection. Audit the use of this call to ensure it is not controllable by an external resource. You may consider using 'shlex.escape()'.","evidencia":"requires login","execucao_id":"C2-ALVO-SINTETICO-R01","ferramenta":"semgrep","linha_final":11,"linha_inicial":11,"recomendacao":null,"regra":"opt.regras-semgrep.python.lang.security.audit.dangerous-subprocess-use-audit","repeticao":1,"saida_bruta_sha256":"11a99d4fc3f3498fd4a904a0f171adb3e11dfdc17b5344957e6b16b54fbea47d","schema_version":"1.0","severidade":"alta","severidade_original":"ERROR","texto_original":"{\"check_id\":\"opt.regras-semgrep.python.lang.security.audit.dangerous-subprocess-use-audit\",\"end\":{\"col\":52,\"line\":11,\"offset\":365},\"extra\":{\"engine_kind\":\"OSS\",\"fingerprint\":\"requires login\",\"lines\":\"requires login\",\"message\":\"Detected subprocess function 'Popen' without a static string. If this data can be controlled by a malicious actor, it may be an instance of command injection. Audit the use of this call to ensure it is not controllable by an external resource. You may consider using 'shlex.escape()'.\",\"metadata\":{\"asvs\":{\"control_id\":\"5.3.8 OS Command Injection\",\"control_url\":\"https://github.com/OWASP/ASVS/blob/master/4.0/en/0x13-V5-Validation-Sanitization-Encoding.md#v53-output-encoding-and-injection-prevention-requirements\",\"section\":\"V5: Validation, Sanitization and Encoding Verification Requirements\",\"version\":\"4\"},\"category\":\"security\",\"confidence\":\"LOW\",\"cwe\":[\"CWE-78: Improper Neutralization of Special Elements used in an OS Command ('OS Command Injection')\"],\"cwe2021-top25\":true,\"cwe2022-top25\":true,\"impact\":\"HIGH\",\"likelihood\":\"LOW\",\"owasp\":[\"A01:2017 - Injection\",\"A03:2021 - Injection\",\"A05:2025 - Injection\"],\"references\":[\"https://stackoverflow.com/questions/3172470/actual-meaning-of-shell-true-in-subprocess\",\"https://docs.python.org/3/library/subprocess.html\",\"https://docs.python.org/3/library/shlex.html\",\"https://semgrep.dev/docs/cheat-sheets/python-command-injection/\"],\"subcategory\":[\"audit\"],\"technology\":[\"python\"]},\"severity\":\"ERROR\",\"validation_state\":\"NO_VALIDATOR\"},\"path\":\"/entrada/alvo_vulneravel.py\",\"start\":{\"col\":1,\"line\":11,\"offset\":314}}"},{"alvo":"ALVO-SINTETICO","arquivo":"alvo_vulneravel.py","condicao":"C2","confianca":null,"confianca_original":"MEDIUM","cwe":"CWE-78","cwe_original":["CWE-78: Improper Neutralization of Special Elements used in an OS Command ('OS Command Injection')"],"descricao":"Found 'subprocess' function 'Popen' with 'shell=True'. This is dangerous because this call will spawn the command using a shell process. Doing so propagates current shell settings and variables, which makes it much easier for a malicious actor to execute commands. Use 'shell=False' instead.","evidencia":"requires login","execucao_id":"C2-ALVO-SINTETICO-R01","ferramenta":"semgrep","linha_final":11,"linha_inicial":11,"recomendacao":"False","regra":"opt.regras-semgrep.python.lang.security.audit.subprocess-shell-true","repeticao":1,"saida_bruta_sha256":"11a99d4fc3f3498fd4a904a0f171adb3e11dfdc17b5344957e6b16b54fbea47d","schema_version":"1.0","severidade":"alta","severidade_original":"ERROR","texto_original":"{\"check_id\":\"opt.regras-semgrep.python.lang.security.audit.subprocess-shell-true\",\"end\":{\"col\":51,\"line\":11,\"offset\":364},\"extra\":{\"engine_kind\":\"OSS\",\"fingerprint\":\"requires login\",\"fix\":\"False\",\"lines\":\"requires login\",\"message\":\"Found 'subprocess' function 'Popen' with 'shell=True'. This is dangerous because this call will spawn the command using a shell process. Doing so propagates current shell settings and variables, which makes it much easier for a malicious actor to execute commands. Use 'shell=False' instead.\",\"metadata\":{\"category\":\"security\",\"confidence\":\"MEDIUM\",\"cwe\":[\"CWE-78: Improper Neutralization of Special Elements used in an OS Command ('OS Command Injection')\"],\"cwe2021-top25\":true,\"cwe2022-top25\":true,\"impact\":\"LOW\",\"likelihood\":\"HIGH\",\"owasp\":[\"A01:2017 - Injection\",\"A03:2021 - Injection\",\"A05:2025 - Injection\"],\"references\":[\"https://stackoverflow.com/questions/3172470/actual-meaning-of-shell-true-in-subprocess\",\"https://docs.python.org/3/library/subprocess.html\"],\"source-rule-url\":\"https://bandit.readthedocs.io/en/latest/plugins/b602_subprocess_popen_with_shell_equals_true.html\",\"subcategory\":[\"secure default\"],\"technology\":[\"python\"]},\"severity\":\"ERROR\",\"validation_state\":\"NO_VALIDATOR\"},\"path\":\"/entrada/alvo_vulneravel.py\",\"start\":{\"col\":47,\"line\":11,\"offset\":360}}"},{"alvo":"ALVO-SINTETICO","arquivo":"alvo_vulneravel.py","condicao":"C2","confianca":null,"confianca_original":"LOW","cwe":"CWE-95","cwe_original":["CWE-95: Improper Neutralization of Directives in Dynamically Evaluated Code ('Eval Injection')"],"descricao":"Detected the use of eval(). eval() can be dangerous if used to evaluate dynamic content. If this content can be input from outside the program, this may be a code injection vulnerability. Ensure evaluated content is not definable by external sources.","evidencia":"requires login","execucao_id":"C2-ALVO-SINTETICO-R01","ferramenta":"semgrep","linha_final":12,"linha_inicial":12,"recomendacao":null,"regra":"opt.regras-semgrep.python.lang.security.audit.eval-detected","repeticao":1,"saida_bruta_sha256":"11a99d4fc3f3498fd4a904a0f171adb3e11dfdc17b5344957e6b16b54fbea47d","schema_version":"1.0","severidade":"media","severidade_original":"WARNING","texto_original":"{\"check_id\":\"opt.regras-semgrep.python.lang.security.audit.eval-detected\",\"end\":{\"col\":14,\"line\":12,\"offset\":379},\"extra\":{\"engine_kind\":\"OSS\",\"fingerprint\":\"requires login\",\"lines\":\"requires login\",\"message\":\"Detected the use of eval(). eval() can be dangerous if used to evaluate dynamic content. If this content can be input from outside the program, this may be a code injection vulnerability. Ensure evaluated content is not definable by external sources.\",\"metadata\":{\"asvs\":{\"control_id\":\"5.2.4 Dyanmic Code Execution Features\",\"control_url\":\"https://github.com/OWASP/ASVS/blob/master/4.0/en/0x13-V5-Validation-Sanitization-Encoding.md#v52-sanitization-and-sandboxing-requirements\",\"section\":\"V5: Validation, Sanitization and Encoding Verification Requirements\",\"version\":\"4\"},\"category\":\"security\",\"confidence\":\"LOW\",\"cwe\":[\"CWE-95: Improper Neutralization of Directives in Dynamically Evaluated Code ('Eval Injection')\"],\"impact\":\"HIGH\",\"likelihood\":\"LOW\",\"owasp\":[\"A03:2021 - Injection\",\"A05:2025 - Injection\"],\"references\":[\"https://owasp.org/Top10/A03_2021-Injection\"],\"source-rule-url\":\"https://bandit.readthedocs.io/en/latest/blacklists/blacklist_calls.html#b307-eval\",\"subcategory\":[\"audit\"],\"technology\":[\"python\"]},\"severity\":\"WARNING\",\"validation_state\":\"NO_VALIDATOR\"},\"path\":\"/entrada/alvo_vulneravel.py\",\"start\":{\"col\":1,\"line\":12,\"offset\":366}}"}]