[{"alvo":"ALVO-0016","arquivo":"app/main.py","condicao":"C2","confianca":null,"confianca_original":null,"cwe":null,"cwe_original":null,"descricao":"Detected a 'requests' call without a timeout set. By default, 'requests' calls wait until the connection is closed. This means a 'requests' call without a timeout will hang the program if a response is never received. Consider setting a timeout for all 'requests'.","evidencia":"requires login","execucao_id":"C2-ALVO-0016-R01","ferramenta":"semgrep","linha_final":31,"linha_inicial":31,"recomendacao":"requests.get(config.PUBLIC_IP_SERVICE_URL, timeout=30)","regra":"opt.regras-semgrep.python.requests.best-practice.use-timeout","repeticao":1,"saida_bruta_sha256":"8bf5bd5c0dddd988baf6a0b696e8e0e551bd38926308321ecd03e6619dfb5856","schema_version":"1.0","severidade":"media","severidade_original":"WARNING","texto_original":"{\"check_id\":\"opt.regras-semgrep.python.requests.best-practice.use-timeout\",\"end\":{\"col\":72,\"line\":31,\"offset\":872},\"extra\":{\"engine_kind\":\"OSS\",\"fingerprint\":\"requires login\",\"fix\":\"requests.get(config.PUBLIC_IP_SERVICE_URL, timeout=30)\",\"lines\":\"requires login\",\"message\":\"Detected a 'requests' call without a timeout set. By default, 'requests' calls wait until the connection is closed. This means a 'requests' call without a timeout will hang the program if a response is never received. Consider setting a timeout for all 'requests'.\",\"metadata\":{\"category\":\"best-practice\",\"references\":[\"https://docs.python-requests.org/en/latest/user/advanced/?highlight=timeout#timeouts\",\"https://requests.readthedocs.io/en/latest/user/quickstart/#timeouts\"],\"technology\":[\"requests\"]},\"severity\":\"WARNING\",\"validation_state\":\"NO_VALIDATOR\"},\"path\":\"/entrada/app/main.py\",\"start\":{\"col\":30,\"line\":31,\"offset\":830}}"}]